{
  "version": 1,
  "id": "F-0001",
  "severity": "blocker",
  "area": "completion_mismark",
  "title": "RM-002 저장 기능이 IMPLEMENTED로 표시되었으나 저장 버튼이 Repository를 호출하지 않음",
  "description": "SaveButton onClick이 TODO 주석만 있고 실제 저장 경로가 연결되지 않았다. 부분 구현 완료 오표기에 해당한다.",
  "source": {
    "kind": "agent",
    "name": "completion-verifier",
    "run_id": "R-20260805-001"
  },
  "roadmap_item_id": "RM-002",
  "task_id": "T-0003",
  "location": {
    "file": "app/src/main/java/com/siamakerlab/memo/ui/edit/MemoEditScreen.kt",
    "line": 87,
    "symbol": "SaveButton"
  },
  "status": "resolved",
  "auto_fixable": true,
  "fix_task_id": "T-0004",
  "resolution": {
    "description": "onClick에 viewModel.save() 연결, 저장 성공·실패 경로 테스트 추가",
    "evidence_ids": ["E-0003"],
    "resolved_at": "2026-08-05T14:20:00+09:00",
    "resolved_by_role": "verifier"
  },
  "history": [
    {
      "from": "open",
      "to": "in_fix",
      "at": "2026-08-05T13:00:00+09:00",
      "reason": "fix 작업 T-0004 생성"
    },
    {
      "from": "in_fix",
      "to": "resolved",
      "at": "2026-08-05T14:20:00+09:00",
      "reason": "재검증 통과"
    }
  ],
  "created_at": "2026-08-05T12:45:00+09:00",
  "updated_at": "2026-08-05T14:20:00+09:00"
}
